{
  "$schema": "cwa-dashboard/assembly-event/v1",
  "event_id": "01M4Z09RNGQMCSN0NZPC5RAT7R",
  "recorded_at": "2026-10-15T05:24:30.000Z",
  "service": {
    "name": "conformance-suite",
    "environment": "demo"
  },
  "assembler": {
    "language": "typescript",
    "name": "@contextwindowarchitecture/assembler",
    "version": "0.0.1"
  },
  "contract": {
    "repository": "contextwindowarchitecture/contextwindowarchitecture",
    "commit": "c252494af79720d23c95d54c0cf9c638d3e43557",
    "lock_sha256": "9aa3f72356a67368ed3db82fa28d1366e7b153c56cd7fec5b509477a6c8a0271"
  },
  "redaction_mode": "full",
  "timings_ms": {
    "total": 0.08920900000001097
  },
  "outcome": "assembled",
  "snapshot": {
    "assembly_time": "2026-09-22T12:00:00Z",
    "scope": {
      "tenant": "acme",
      "user": "u_91",
      "session": "s_7",
      "task": "refund_request"
    },
    "budget": {
      "input": 4096,
      "reserved_output": 1024
    },
    "profile": {
      "spec": "cwa/draft",
      "id": "messages-repeated-slot",
      "version": 1,
      "route": "support-chat",
      "model_family": null,
      "route_policy_version": "messages-repeated-slot/v1",
      "placement": [
        {
          "slot": "governance.instructions",
          "wrap": "system"
        },
        {
          "slot": "governance.examples",
          "wrap": "system"
        },
        {
          "slot": "governance.examples",
          "wrap": "xml:examples"
        },
        {
          "slot": "interaction.query",
          "wrap": "xml:query"
        }
      ],
      "evaluation": {
        "status": "unevaluated",
        "suite": null,
        "date": null,
        "result": null,
        "artifact": null
      }
    },
    "route_policy": {
      "route": "support-chat",
      "version": "messages-repeated-slot/v1",
      "producers": {
        "policy-registry": {
          "kind": "policy",
          "slots": [
            "governance.examples",
            "governance.instructions",
            "governance.output_contract"
          ]
        },
        "cap-policy": {
          "kind": "capability_policy",
          "slots": [
            "governance.capabilities"
          ]
        },
        "state-svc": {
          "kind": "state",
          "slots": [
            "state.task",
            "state.user"
          ]
        },
        "policy-corpus": {
          "kind": "retrieval",
          "slots": [
            "evidence.knowledge"
          ]
        },
        "conversation": {
          "kind": "interaction",
          "slots": [
            "interaction.history",
            "interaction.query"
          ]
        }
      },
      "slots": {
        "evidence.knowledge": {
          "min_relevance": 0.5,
          "required_scope": [
            "tenant"
          ]
        }
      },
      "tier_upgrades": {
        "governance.examples": "compressible"
      }
    },
    "tokenizer": "estimate-utf8/v1",
    "renderer": "cwa-messages/v1",
    "batches": [
      {
        "producer": {
          "id": "conversation",
          "kind": "interaction"
        },
        "items": [
          {
            "id": "turn:18",
            "slot": "interaction.query",
            "source": "src:turn:18",
            "source_version": "1",
            "authority": "user",
            "trust": "unverified",
            "freshness": "2026-09-22T11:59:00Z",
            "body": "Can I refund my Pro plan?",
            "token_budget": null,
            "variants": [],
            "conflict_policy": "defers",
            "lineage": "verbatim",
            "eligibility": "route-policy",
            "injection_risk": "untrusted_content"
          }
        ],
        "excluded": []
      },
      {
        "producer": {
          "id": "policy-registry",
          "kind": "policy"
        },
        "items": [
          {
            "id": "policy:v12",
            "slot": "governance.instructions",
            "source": "src:policy:v12",
            "source_version": "1",
            "authority": "governing",
            "trust": "verified",
            "freshness": "2026-09-22T11:59:00Z",
            "body": "Follow verified refund policy & cite the evidence you use. Never quote <internal> notes.",
            "token_budget": null,
            "variants": [],
            "conflict_policy": "governs",
            "lineage": "verbatim",
            "eligibility": "route-policy",
            "injection_risk": "none"
          },
          {
            "id": "ex:qa",
            "slot": "governance.examples",
            "source": "src:ex:qa",
            "source_version": "1",
            "authority": "governing",
            "trust": "verified",
            "freshness": "2026-09-22T11:59:00Z",
            "body": "Example: Q&A on refunds & returns & exchanges & store credit & fees & disputes & chargebacks.",
            "token_budget": 28,
            "variants": [
              {
                "id": "ex:qa~short",
                "body": "Example: Q&A on refunds & returns.",
                "method": "extract",
                "lineage": "extracted"
              }
            ],
            "conflict_policy": "defers",
            "lineage": "verbatim",
            "eligibility": "route-policy",
            "injection_risk": "none"
          }
        ],
        "excluded": []
      }
    ],
    "conflicts": []
  },
  "trace": {
    "trace_id": "trace-01m4z09rngqmcsn0nzpc5rat7r",
    "profile": {
      "id": "messages-repeated-slot",
      "version": 1
    },
    "budget": {
      "input": 4096,
      "reserved_output": 1024
    },
    "result": {
      "input_tokens": 65,
      "hash": "fc987adf7e260862807dcd9c5e2795987ea8b61a354d9ea294af90aa5cf9851b"
    },
    "included": [
      {
        "slot": "governance.instructions",
        "item_id": "policy:v12",
        "tokens": 22,
        "source_version": "1",
        "eligibility": "route-policy"
      },
      {
        "slot": "governance.examples",
        "item_id": "ex:qa",
        "tokens": 9,
        "source_version": "1",
        "eligibility": "route-policy"
      },
      {
        "slot": "governance.examples",
        "item_id": "ex:qa",
        "tokens": 11,
        "source_version": "1",
        "eligibility": "route-policy"
      },
      {
        "slot": "interaction.query",
        "item_id": "turn:18",
        "tokens": 7,
        "source_version": "1",
        "eligibility": "route-policy"
      }
    ],
    "compressed": [
      {
        "slot": "governance.examples",
        "item_id": "ex:qa",
        "from": 24,
        "to": 9,
        "method": "extract",
        "variant_id": "ex:qa~short"
      },
      {
        "slot": "governance.examples",
        "item_id": "ex:qa",
        "from": 31,
        "to": 11,
        "method": "extract",
        "variant_id": "ex:qa~short"
      }
    ],
    "excluded": [],
    "conflicts": [],
    "refused": {
      "bool": false,
      "reason": null
    },
    "context": {
      "spec": "cwa/draft",
      "assembly_time": "2026-09-22T12:00:00Z",
      "route_policy_version": "messages-repeated-slot/v1",
      "tokenizer": "estimate-utf8/v1",
      "renderer": "cwa-messages/v1",
      "snapshot_digest": "f59fc2d28188e6806644b56f9a016a771196477c7e082f684af95e73c3f409ae"
    },
    "defaults_filled": [],
    "timings": {
      "admission": 0.014499999999998181,
      "conflicts": 0.0005409999999983484,
      "supersession": 0.0006659999999953925,
      "deduplication": 0.0005419999999958236,
      "diversity": 0.0005000000000165983,
      "fitting": 0.026958000000007587
    }
  },
  "payload": {
    "hash": "fc987adf7e260862807dcd9c5e2795987ea8b61a354d9ea294af90aa5cf9851b",
    "bytes": 385,
    "parts": [
      {
        "section": "system",
        "id": "policy:v12",
        "sha256": "28228205c3f61a5765e145ddd74bbd3a0c961cc53e30860187dc2538856a9efa",
        "bytes": 88
      },
      {
        "section": "system",
        "id": "ex:qa",
        "sha256": "2b76d232d741df444d786a2a730d5800519c413253bf3b61d0437eca38797797",
        "bytes": 34
      },
      {
        "section": "content",
        "sha256": "89eab9d5dfb84d78cfc664d0b9dfc4a9374c7f75762b2ea56c19aa745e9abe26",
        "bytes": 133
      }
    ]
  }
}
