{
  "$schema": "cwa-dashboard/assembly-event/v1",
  "event_id": "01M4YZQEQGCNCGBPXQ3A95H12A",
  "recorded_at": "2026-10-15T05:14:30.000Z",
  "service": {
    "name": "conformance-suite",
    "environment": "demo"
  },
  "assembler": {
    "language": "typescript",
    "name": "@contextwindowarchitecture/assembler",
    "version": "0.0.1"
  },
  "contract": {
    "repository": "contextwindowarchitecture/contextwindowarchitecture",
    "commit": "c252494af79720d23c95d54c0cf9c638d3e43557",
    "lock_sha256": "9aa3f72356a67368ed3db82fa28d1366e7b153c56cd7fec5b509477a6c8a0271"
  },
  "redaction_mode": "full",
  "timings_ms": {
    "total": 0.5292919999999981
  },
  "outcome": "refused",
  "snapshot": {
    "assembly_time": "2026-09-22T12:00:00Z",
    "scope": {
      "tenant": "acme",
      "user": "u_91",
      "session": "s_7",
      "task": "refund_request"
    },
    "budget": {
      "input": 4000,
      "reserved_output": 1024
    },
    "profile": {
      "spec": "cwa/draft",
      "id": "dedupe-evidence-required",
      "version": 1,
      "route": "support-chat",
      "model_family": null,
      "route_policy_version": "dedupe-evidence-required/v1",
      "placement": [
        {
          "slot": "governance.instructions",
          "wrap": "xml:governance.instructions"
        },
        {
          "slot": "governance.examples",
          "wrap": "xml:governance.examples"
        },
        {
          "slot": "governance.output_contract",
          "wrap": "xml:governance.output_contract"
        },
        {
          "slot": "state.user",
          "wrap": "xml:state.user"
        },
        {
          "slot": "state.task",
          "wrap": "xml:state.task"
        },
        {
          "slot": "evidence.knowledge",
          "wrap": "xml:evidence.knowledge"
        },
        {
          "slot": "evidence.tool_results",
          "wrap": "xml:evidence.tool_results"
        },
        {
          "slot": "interaction.memory",
          "wrap": "xml:interaction.memory"
        },
        {
          "slot": "interaction.history",
          "wrap": "xml:interaction.history"
        },
        {
          "slot": "interaction.query",
          "wrap": "xml:interaction.query"
        }
      ],
      "evaluation": {
        "status": "unevaluated",
        "suite": null,
        "date": null,
        "result": null,
        "artifact": null
      }
    },
    "route_policy": {
      "route": "support-chat",
      "version": "dedupe-evidence-required/v1",
      "producers": {
        "policy-registry": {
          "kind": "policy",
          "slots": [
            "governance.examples",
            "governance.instructions",
            "governance.output_contract"
          ]
        },
        "state-svc": {
          "kind": "state",
          "slots": [
            "state.task",
            "state.user"
          ]
        },
        "policy-corpus": {
          "kind": "retrieval",
          "slots": [
            "evidence.knowledge"
          ]
        },
        "wiki-corpus": {
          "kind": "retrieval",
          "slots": [
            "evidence.knowledge"
          ]
        },
        "crm-mcp": {
          "kind": "mcp",
          "slots": [
            "evidence.tool_results"
          ]
        },
        "memory-svc": {
          "kind": "memory",
          "slots": [
            "interaction.memory"
          ]
        },
        "conversation": {
          "kind": "interaction",
          "slots": [
            "interaction.history",
            "interaction.query"
          ]
        }
      },
      "slots": {
        "evidence.knowledge": {
          "min_relevance": 0.5,
          "required_scope": [
            "tenant"
          ],
          "dedupe": "exact",
          "min_included": 2
        }
      },
      "requires_evidence": true
    },
    "tokenizer": "fixture-whitespace/v1",
    "renderer": "fixture-xml/v1",
    "batches": [
      {
        "producer": {
          "id": "conversation",
          "kind": "interaction"
        },
        "items": [
          {
            "id": "turn:18",
            "slot": "interaction.query",
            "source": "src:turn:18",
            "source_version": "1",
            "authority": "user",
            "trust": "unverified",
            "freshness": "2026-09-22T11:59:00Z",
            "body": "Can I refund my Pro plan?",
            "token_budget": null,
            "variants": [],
            "conflict_policy": "defers",
            "lineage": "verbatim",
            "eligibility": "route-policy",
            "injection_risk": "untrusted_content"
          }
        ],
        "excluded": []
      },
      {
        "producer": {
          "id": "policy-corpus",
          "kind": "retrieval"
        },
        "items": [
          {
            "id": "kb:a",
            "slot": "evidence.knowledge",
            "source": "src:kb:a",
            "source_version": "1",
            "authority": "reference_only",
            "trust": "unverified",
            "freshness": "2026-09-12T15:30:00Z",
            "body": "Pro plans refund in full within 30 days.",
            "token_budget": null,
            "variants": [],
            "conflict_policy": "defers",
            "lineage": "verbatim",
            "eligibility": "route-policy",
            "injection_risk": "untrusted_content",
            "scope": {
              "tenant": "acme"
            },
            "relevance": 0.9
          },
          {
            "id": "kb:b",
            "slot": "evidence.knowledge",
            "source": "src:kb:b",
            "source_version": "1",
            "authority": "reference_only",
            "trust": "unverified",
            "freshness": "2026-09-12T15:30:00Z",
            "body": "Pro plans refund in full within 30 days.\n",
            "token_budget": null,
            "variants": [],
            "conflict_policy": "defers",
            "lineage": "verbatim",
            "eligibility": "route-policy",
            "injection_risk": "untrusted_content",
            "scope": {
              "tenant": "acme"
            },
            "relevance": 0.8
          }
        ],
        "excluded": []
      },
      {
        "producer": {
          "id": "policy-registry",
          "kind": "policy"
        },
        "items": [
          {
            "id": "policy:v12",
            "slot": "governance.instructions",
            "source": "src:policy:v12",
            "source_version": "1",
            "authority": "governing",
            "trust": "verified",
            "freshness": "2026-09-22T11:59:00Z",
            "body": "Follow verified refund policy and cite the evidence you use.",
            "token_budget": null,
            "variants": [],
            "conflict_policy": "governs",
            "lineage": "verbatim",
            "eligibility": "route-policy",
            "injection_risk": "none"
          }
        ],
        "excluded": []
      }
    ],
    "conflicts": []
  },
  "trace": {
    "trace_id": "trace-01m4yzqeqgcncgbpxq3a95h12a",
    "profile": {
      "id": "dedupe-evidence-required",
      "version": 1
    },
    "budget": {
      "input": 4000,
      "reserved_output": 1024
    },
    "result": null,
    "included": [],
    "compressed": [],
    "excluded": [
      {
        "item_id": "kb:b",
        "reason": "duplicate_content",
        "stage": "assembler",
        "slot": "evidence.knowledge",
        "duplicate_of": "kb:a"
      }
    ],
    "conflicts": [],
    "refused": {
      "bool": true,
      "reason": "evidence_required"
    },
    "context": {
      "spec": "cwa/draft",
      "assembly_time": "2026-09-22T12:00:00Z",
      "route_policy_version": "dedupe-evidence-required/v1",
      "tokenizer": "fixture-whitespace/v1",
      "renderer": "fixture-xml/v1",
      "snapshot_digest": "fcd79fdf4d0ff23a4b3187011b6814b3098c5184228a7a453b9c73f61123e66d"
    },
    "defaults_filled": [],
    "recovery": {
      "action": "request_context"
    },
    "timings": {
      "admission": 0.018665999999996075,
      "conflicts": 0.001125000000001819,
      "supersession": 0.0007090000000005148,
      "deduplication": 0.0762500000000017,
      "diversity": 0.001208000000005427,
      "fitting": 0.04137500000000216
    }
  }
}
